{
  "active_output_set": "phase5_baseline",
  "checks": {
    "canonical_repair_owner_valid": true,
    "controlled_fault_detection": "PASS",
    "external_skill_unchanged": true,
    "git_clean_at_evaluation": true,
    "html_screenshot_stabilization": "PASS",
    "invalidation_complete": true,
    "phase4_unchanged": true,
    "phase5_unchanged": true,
    "phase61a1_reconciliation": "PASS",
    "phase6a_baseline_composite": "PASS",
    "postcommit_baseline_reachability": "PASS",
    "protected_outputs_absent": true,
    "removed_skill_absent": true,
    "repair_waves_allowed": 3,
    "repair_waves_used": 1,
    "repaired_composite_qa": "PASS",
    "repaired_external_reconciliation": "PASS",
    "repaired_official_final_gate": "PASS",
    "repaired_render_count": 6,
    "repaired_screenshot_count": 6
  },
  "created_at": "2026-07-22T10:29:26.436575+09:00",
  "devpost_release_eligible": false,
  "final_release_eligible": false,
  "phase6_accepted": true,
  "phase7_required": true,
  "phase7_started": false,
  "report_hash": "fad95607449de5ebfe1d643d62e77894d9beefe4e8a2b8a36ca49e63b830dd3f",
  "report_id": "release_gate_7e86c35275b085548011",
  "schema_name": "phase6_unified_release_gate_report",
  "schema_version": "1.0.0",
  "source_commit": "21bcd35e5919dc340e01be74ced0a51f23931f08",
  "status": "ELIGIBLE_FOR_PACKAGING",
  "timezone": "Asia/Seoul"
}
